{
  "type": "WORKFLOW_PROFILE",
  "schemaVersion": 2,
  "name": "documentation-default",
  "description": "Technical writing, documentation sites, and source-backed repository knowledge with advisory checks.",
  "marketplaces": [
    {
      "type": "WORKFLOW_MARKETPLACE",
      "name": "slopsentral",
      "provider": "codex",
      "source": "https://github.com/amichne/slopsentral/tree/harness/codex",
      "entrypoint": ".agents/plugins/marketplace.json",
      "scope": "plugins in this workflow profile"
    }
  ],
  "plugins": [
    "repository-knowledge"
  ],
  "standaloneSkills": [],
  "hookPolicy": {
    "type": "HOOK_POLICY",
    "mode": "ADVISORY"
  },
  "reconciliation": {
    "type": "PLUGIN_RECONCILIATION",
    "unselected": "DISABLE_UNSELECTED"
  },
  "validation": {
    "type": "WORKFLOW_VALIDATION",
    "commands": [
      "node tools/validate-source-graph.mjs",
      "node tools/project-marketplaces.mjs --source . --harness codex --out /tmp/slopsentral-codex",
      "node tools/project-marketplaces.mjs --source . --harness github-copilot --out /tmp/slopsentral-github-copilot"
    ]
  }
}
